{
  "conditions": [
    {
      "modid": "earthmobsmod",
      "type": "forge:mod_loaded"
    }
  ],
  "entity": "earthmobsmod:wooly_cow",
  "variants": [],
  "name": "entity.earthmobsmod.wooly_cow",
  "name_color": "#f9801d",
  "display_nbt": {},
  "gui_scale": 1,
  "gui_x_offset": 0,
  "gui_y_offset": 0,
  "gui_z_offset": 0,
  "sim_cost": 2560,
  "input": {
    "item": "hostilenetworks:prediction_matrix",
    "count": 1
  },
  "base_drop": {
    "item": "minecraft:orange_dye",
    "count": 1
  },
  "trivia": "hostilenetworks.trivia.wooly_cow",
  "fabricator_drops": [
    {
      "item": "minecraft:orange_wool",
      "count": 8
    },
    {
      "item": "minecraft:beef",
      "count": 8
    },
    {
      "item": "minecraft:leather",
      "count": 8
    }
  ],
  "tier_data": [12, 60, 360, 1260],
  "data_per_kill": [1, 4, 10, 18]
}
