{
  "conditions": [
    {
      "modid": "energeticsheep",
      "type": "forge:mod_loaded"
    }
  ],
  "entity": "energeticsheep:energetic_sheep",
  "variants": [],
  "name": "entity.energeticsheep.energetic_sheep",
  "name_color": "#f9ffff",
  "display_nbt": {},
  "gui_scale": 1,
  "gui_x_offset": 0,
  "gui_y_offset": 0,
  "gui_z_offset": 0,
  "sim_cost": 1280,
  "input": {
    "item": "hostilenetworks:prediction_matrix",
    "count": 1
  },
  "base_drop": {
    "item": "minecraft:white_dye",
    "count": 1
  },
  "trivia": "hostilenetworks.trivia.energetic_sheep",
  "fabricator_drops": [
    {
      "item": "energeticsheep:white_energetic_wool",
      "count": 32
    },
    {
      "item": "minecraft:mutton",
      "count": 32
    },
    {
      "item": "gateways:gate_pearl",
      "count": 32,
      "nbt": "{gateway:\"gateways:normal/energetic_sheep\"}",
      "optional": true
    }
  ],
  "tier_data": [12, 60, 360, 1260],
  "data_per_kill": [1, 4, 10, 18]
}
