{
  "entity": "minecraft:iron_golem",
  "variants": [],
  "name": "entity.minecraft.iron_golem",
  "name_color": "#9c9d97",
  "display_nbt": {},
  "gui_scale": 1,
  "gui_x_offset": 0,
  "gui_y_offset": 0,
  "gui_z_offset": 0,
  "sim_cost": 256,
  "input": {
    "item": "hostilenetworks:prediction_matrix",
    "count": 1
  },
  "base_drop": {
    "item": "minecraft:light_gray_dye",
    "count": 1
  },
  "trivia": "hostilenetworks.trivia.iron_golem",
  "fabricator_drops": [
    {
      "item": "minecraft:iron_ingot",
      "count": 64
    },
    {
      "item": "minecraft:poppy",
      "count": 42
    }
  ],
  "tier_data": [12, 60, 360, 1260],
  "data_per_kill": [1, 4, 10, 18]
}
