{
  "entity": "minecraft:spider",
  "variants": [],
  "name": "entity.minecraft.spider",
  "name_color": "#1d1c21",
  "display_nbt": {},
  "gui_scale": 1,
  "gui_x_offset": 0,
  "gui_y_offset": 0,
  "gui_z_offset": 0,
  "sim_cost": 256,
  "input": {
    "item": "hostilenetworks:prediction_matrix",
    "count": 1
  },
  "base_drop": {
    "item": "minecraft:black_dye",
    "count": 1
  },
  "trivia": "hostilenetworks.trivia.spider",
  "fabricator_drops": [
    {
      "item": "minecraft:string",
      "count": 64
    },
    {
      "item": "minecraft:spider_eye",
      "count": 30
    },
    {
      "item": "simplehats:hatbag_common",
      "count": 5,
      "optional": true
    },
    {
      "item": "simplehats:hatbag_uncommon",
      "count": 4,
      "optional": true
    },
    {
      "item": "silentgear:fine_silk",
      "count": 3,
      "optional": true
    },
    {
      "item": "simplehats:hatbag_rare",
      "count": 2,
      "optional": true
    },
    {
      "item": "simplehats:hatbag_epic",
      "count": 1,
      "optional": true
    }
  ],
  "tier_data": [12, 60, 360, 1260],
  "data_per_kill": [1, 4, 10, 18]
}
