{
  "conditions": [
    {
      "modid": "forcecraft",
      "type": "forge:mod_loaded"
    }
  ],
  "entity": "forcecraft:green_chu_chu",
  "variants": [],
  "name": "entity.forcecraft.green_chu_chu",
  "name_color": "#5d7c15",
  "display_nbt": {},
  "gui_scale": 1,
  "gui_x_offset": 0,
  "gui_y_offset": 0,
  "gui_z_offset": 0,
  "sim_cost": 256,
  "input": {
    "item": "hostilenetworks:prediction_matrix",
    "count": 1
  },
  "base_drop": {
    "item": "minecraft:green_dye",
    "count": 1
  },
  "trivia": "hostilenetworks.trivia.green_chu_chu",
  "fabricator_drops": [
    {
      "item": "forcecraft:green_chu_jelly",
      "count": 64
    }
  ],
  "tier_data": [12, 60, 360, 1260],
  "data_per_kill": [1, 4, 10, 18]
}
