{
  "conditions": [
    {
      "modid": "colourfulgoats",
      "type": "forge:mod_loaded"
    }
  ],
  "entity": "colourfulgoats:goat",
  "variants": [],
  "name": "entity.colourfulgoats.goat",
  "name_color": "#f9ffff",
  "display_nbt": {},
  "gui_scale": 1,
  "gui_x_offset": 0,
  "gui_y_offset": 0,
  "gui_z_offset": 0,
  "sim_cost": 1280,
  "input": {
    "item": "hostilenetworks:prediction_matrix",
    "count": 1
  },
  "base_drop": {
    "item": "minecraft:white_dye",
    "count": 1
  },
  "trivia": "hostilenetworks.trivia.goat",
  "fabricator_drops": [
    {
      "item": "minecraft:white_wool",
      "count": 32
    },
    {
      "item": "colourfulgoats:goat_steak",
      "count": 32
    }
  ],
  "tier_data": [12, 60, 360, 1260],
  "data_per_kill": [1, 4, 10, 18]
}
